标题,摘要,发布时间,链接
闪迪公司股价飙升24% 将自上市以来的累计涨幅提升至1755%,闪迪公司股价飙升24%，将自上市以来的累计涨幅提升至1755%。,2026-01-30 22:33:29,https://finance.eastmoney.com/a/202601303637365120.html
美股开盘集体下跌,美股开盘集体下跌，道指跌0.34%，纳指跌0.45%，标普500指数跌0.35%。存储板块强势上涨，闪迪再度大涨22%，开年以来已经涨超130%；闪迪2026财年Q2营收和每股收益均远超预期。美光科技涨3.3%，西部数据涨2%。贵金属板块集体走低，泛美白银大跌近11%，哈莫尼黄金跌8.6%，纽曼矿业跌6.8%。,2026-01-30 22:30:50,https://finance.eastmoney.com/a/202601303637363871.html
飞天茅台单瓶破1800元,【飞天茅台单瓶破1800元】节前茅台迎来了价格大反弹。第一财经记者实地走访深圳多家经销商门店发现，飞天茅台单瓶破1800元，一夜之间涨幅超百元。多家门店表示，当前处于缺货状态，节前应该很难补货，叠加春节消费需求旺盛，导致价格回升。,2026-01-30 22:26:53,https://finance.eastmoney.com/a/202601303637362953.html
OpenAI联合创始人、a16z据悉向支持人工智能的超级政治行动委员会捐款,【OpenAI联合创始人、a16z据悉向支持人工智能的超级政治行动委员会捐款】1月30日消息，据报道，支持人工智能的超级政治行动委员会“引领未来”已筹集超过1.25亿美元，OpenAI前总裁、联合创始人格雷格·布罗克曼、8VC创始人及管理合伙人乔·朗斯代尔，以及硅谷知名创投公司安德里森·霍罗威茨（Andreessen Horowitz，又简称为a16z）均向该基金捐款。,2026-01-30 22:23:38,https://finance.eastmoney.com/a/202601303637361276.html
AMD盘前跌幅扩大 现跌超5%,AMD盘前跌幅扩大，现跌超5%。,2026-01-30 22:22:24,https://finance.eastmoney.com/a/202601303637360666.html
240吨级商业重复使用高压补燃液氧煤油发动机长程试车成功,【240吨级商业重复使用高压补燃液氧煤油发动机长程试车成功】记者从中国航天科技集团有限公司获悉，1月29日，航天科技集团第六研究院240吨级商业重复使用高压补燃液氧煤油发动机200秒长程试车取得圆满成功。该型发动机面向国内商业用户，为大中型可重复使用运载火箭而开发，其性能指标达到国际领先水平。,2026-01-30 22:14:50,https://finance.eastmoney.com/a/202601303637356143.html
麒盛科技：迈动数康以非侵入式脑机接口为核心 攻克多项关键技术,【麒盛科技：迈动数康以非侵入式脑机接口为核心 攻克多项关键技术】麒盛科技今日官微消息，公司通过控股迈动数康布局脑机接口领域、设立先辰智造发力机器人赛道，布局未来产业建设。其中，迈动数康以非侵入式脑机接口为核心，攻克多项关键技术，包括攻克时域干涉（TI）神经调控技术，构建“脑电事件触发式”精准调控体系，解决传统睡眠干预缺乏个性化的问题。,2026-01-30 22:09:51,https://finance.eastmoney.com/a/202601303637354276.html
深康佳Ａ：预计2025年净亏损125.81亿元-155.73亿元,【深康佳Ａ：预计2025年净亏损125.81亿元-155.73亿元】深康佳Ａ(000016.SZ)公告称，预计2025年归属于上市公司股东的净利润为亏损155.73亿元至125.81亿元，上年同期为亏损32.96亿元。,2026-01-30 22:06:43,https://finance.eastmoney.com/a/202601303637353192.html
金科连亏三年后突然盈利300亿 怎么做到的？,【金科连亏三年后突然盈利300亿 怎么做到的？】1月30日晚间，重庆房企金科股份（证券简称：*ST金科，000656.SZ）突然连发两条重磅公告。其中一条为2025年业绩预告，该公告显示，金科股份预计2025年度归属于上市公司股东的净利润为300亿元-350亿元。,2026-01-30 21:58:08,https://finance.eastmoney.com/a/202601303637349678.html
特朗普为啥选中沃什接棒鲍威尔？和雅诗兰黛家族有关？看看他的来时路,【特朗普为啥选中沃什接棒鲍威尔？和雅诗兰黛家族有关？看看他的来时路】当地时间30日，美国总统特朗普提名美联储前理事沃什出任美联储下一任主席。“很多人认为，这个人几年前就应该担任这个职位。”特朗普曾在29日的一场活动上“剧透”，“他将是一位备受尊敬、在金融界家喻户晓的人物。”,2026-01-30 21:56:48,https://finance.eastmoney.com/a/202601303637349323.html
沪银期货主力合约日内跌幅扩大至15%,【沪银期货主力合约日内跌幅扩大至15%】沪银期货主力合约跌15.25%，沪锡期货主力合约跌6.94%，沪金期货主力合约跌5.36%，沪镍期货主力合约跌4.61%，沪铜期货主力合约跌4.32%，沪铝期货主力合约跌4.11%。,2026-01-30 21:47:18,https://finance.eastmoney.com/a/202601303637336447.html
美联储BOSTIC：需要有明确证据表明通胀率已恢复到2%水平,美联储BOSTIC表示，需要有明确证据表明通胀率已恢复到2%水平；通胀还有很长的路要走，需要保持警惕。,2026-01-30 21:46:44,https://finance.eastmoney.com/a/202601303637338172.html
我国将进一步加强直播电商行业常态化监管,【我国将进一步加强直播电商行业常态化监管】市场监管总局网监司副司长舒玲敏30日表示，经过1年的直播电商专项治理，直播电商行业乱象得到初步遏制。2026年，市场监管总局将坚持问题导向，积极会同有关部门，进一步加强直播电商行业常态化监管，切实维护广大消费者和经营者合法权益。,2026-01-30 21:44:59,https://finance.eastmoney.com/a/202601303637335144.html
120Gbps！中国星地激光通信传输速率刷新纪录,【120Gbps！中国星地激光通信传输速率刷新纪录】中国科学院空天信息创新研究院近日成功开展超百G星地激光通信业务化应用实验，通过卫星在轨软件重构，充分挖掘利用激光通信载荷的硬件潜能，将卫星激光通信载荷的能力从60Gbps提升至120Gbps，刷新了国内星地激光通信传输速率纪录，标志着我国星地激光通信业务化应用能力迈上一个新台阶。,2026-01-30 21:43:37,https://finance.eastmoney.com/a/202601303637334661.html
又一家国产芯片厂宣布涨价！,【又一家国产芯片厂宣布涨价！】继中微半导、国科微宣布相关芯片产品涨价后，近日，国产芯片厂商英集芯也发布了涨价函，宣布对旗下部分产品进行涨价，但具体涨幅并未公布。,2026-01-30 21:41:32,https://finance.eastmoney.com/a/202601303637334043.html
鞍钢股份：预计2025年净亏损40.77亿元 同比减亏42.75%,【鞍钢股份：预计2025年净亏损40.77亿元 同比减亏42.75%】鞍钢股份(000898.SZ)公告称，预计2025年归属于上市公司股东的净利润为亏损40.77亿元左右，上年同期亏损71.22亿元，同比减亏约42.75%。,2026-01-30 21:37:03,https://finance.eastmoney.com/a/202601303637326623.html
九鼎投资：2025年预亏3亿元—3.5亿元,【九鼎投资：2025年预亏3亿元—3.5亿元】九鼎投资(600053)1月30日发布业绩公告，预计2025年度实现归属于上市公司股东的净利润-3.5亿元到-3亿元，与上年同期相比，亏损将增加。,2026-01-30 21:32:26,https://finance.eastmoney.com/a/202601303637325356.html
美国12月不包括食品和能源的核心PPI升0.7% 预期升0.3%,美国12月不包括食品和能源的核心PPI升0.7%，预期升0.3%。,2026-01-30 21:32:07,https://finance.eastmoney.com/a/202601303637318029.html
美国12月PPI同比增长3% 预期2.7%,美国12月PPI同比增长3%，预期2.7%，前值3.0%。,2026-01-30 21:31:10,https://finance.eastmoney.com/a/202601303637317881.html
