标题,摘要,发布时间,链接
千问口令无法在微信复制分享,【千问口令无法在微信复制分享】多名用户向记者反馈，目前千问的春节活动口令无法在微信进行复制传播，选中千问的活动口令后，微信页面没有复制键。,2026-02-06 13:19:48,https://finance.eastmoney.com/a/202602063643978125.html
小鹏GX开启L4级自动驾驶开放测试,【小鹏GX开启L4级自动驾驶开放测试】记者获悉，即将发布的小鹏首款大六座SUV小鹏GX，将搭载4颗图灵芯片，本地有效算力3000TOPS，具备L4级自动驾驶能力，目前正在进行技术验证。今日一辆车身贴有 “L4自动驾驶测试”及“注意避让” 标识的小鹏伪装车，在广州开放路段进行测试。,2026-02-06 13:16:34,https://finance.eastmoney.com/a/202602063643975128.html
亚马逊：已发射180颗卫星 计划在今明两年共进行超50次发射,【亚马逊：已发射180颗卫星 计划在今明两年共进行超50次发射】当地时间2月5日，亚马逊总裁兼首席执行官安迪·贾西在2025财年第四财季财报电话会上透露，Amazon Leo（即低地球轨道卫星项目）方面取得了快速进展，将为无法获得宽带连接的地方的消费者、企业和政府带来连接。,2026-02-06 13:14:55,https://finance.eastmoney.com/a/202602063643974151.html
太阳爆发最高等级耀斑 引发轻度地磁暴,【太阳爆发最高等级耀斑 引发轻度地磁暴】美国国家海洋和大气管理局5日发布警报说，受太阳爆发强烈耀斑影响，地球已出现并可能继续出现轻度地磁暴。,2026-02-06 13:13:43,https://finance.eastmoney.com/a/202602063643972727.html
油气股午后持续走强 通源石油涨超11%,油气股午后持续走强，通源石油涨超11%，科力股份涨超9%，洲际油气涨超8%，潜能恒信、准油股份、新锦动力、中曼石油等跟涨。,2026-02-06 13:11:42,https://finance.eastmoney.com/a/202602063643971588.html
日本前高级外汇官员：外汇干预配合加息效果将更为持久,【日本前高级外汇官员：外汇干预配合加息效果将更为持久】日本前高级外汇官员中尾武彦表示，动用外汇储备进行汇率干预，虽然可以对市场产生立竿见影的冲击，但如果配合持续加息，其效果将更为持久。中尾武彦曾在2011-2013年期间担任负责国际事务的副财相。,2026-02-06 13:08:59,https://finance.eastmoney.com/a/202602063643969389.html
阿里概念股午后拉升 数据港涨停,阿里概念股午后拉升，数据港涨停，润建股份、顺钠股份、杭钢股份、壹网壹创等跟涨。,2026-02-06 13:03:55,https://finance.eastmoney.com/a/202602063643964968.html
海南首批岛内居民日用消费品免税店拟定于2月11日开业,【海南首批岛内居民日用消费品免税店拟定于2月11日开业】海南省新闻办公室6日举行新闻发布会，介绍海南自由贸易港岛内居民消费进境商品“零关税”政策有关情况。记者从会上获悉，海南首批岛内居民日用消费品免税店拟定于2026年2月11日开业。,2026-02-06 13:01:52,https://finance.eastmoney.com/a/202602063643962346.html
金店一个月扫出1700克金粉！同行揭秘,【金店一个月扫出1700克金粉！同行揭秘】金价维持在高位，现在很多人都在排队“打金”。相比于直接买金首饰，打金的体验感更强，不仅可以定制款式，价格也相较品牌金饰更便宜，赢得了不少消费者的青睐。近日，“打金店1个月扫出1700克金粉”的话题引发网友广泛关注与讨论。不少朋友疑惑，这些金粉是从哪里来的，打金店为什么能攒下这么多？黄金加工过程中的损耗，需要消费者承担吗？,2026-02-06 12:58:34,https://finance.eastmoney.com/a/202602063643954513.html
光纤光缆大爆发！一则利好突然来袭！,【光纤光缆大爆发！一则利好突然来袭！】2月6日早盘，最先爆发的是光纤光缆行业，市值近700亿元的长飞光纤开盘13分钟后涨停，续创历史新高。随后，通鼎互联、亨通光电、长盈通等集体大涨。根据券商研报，2026年1月，中国市场G.652.D单模光纤价格创下近七年来的新高，平均价格来到35元/芯公里以上。还有部分报价突破40元/芯公里，年内涨幅超80%，创行业罕见涨幅。,2026-02-06 12:56:42,https://finance.eastmoney.com/a/202602063643953963.html
4001只私募产品1月净值创新高,【4001只私募产品1月净值创新高】1441家私募旗下共计4001只私募产品的净值在今年1月创下历史新高。经统计，至少有3只产品有近3年业绩展示（成立满3年）且符合排名规则的私募有139家，其中百亿私募仅14家，股票策略私募占8家，收益均值排名前五的私募依次为天演资本、复胜资产、诚奇私募、幻方量化、明汯投资。,2026-02-06 12:54:12,https://finance.eastmoney.com/a/202602063643953439.html
中际旭创盘中跌超5%！公募头号重仓股遭遇“登顶之困”？,【中际旭创盘中跌超5%！公募头号重仓股遭遇“登顶之困”？】作为公募第一大重仓股，市场看待中际旭创，用的是“显微镜”和“望远镜”，即对公司关注颗粒度更高，对预期变化的关注度更高；另外，山巅之上，情绪之风更为明显，筹码受情绪性因素影响的情况更加突出。,2026-02-06 12:51:00,https://finance.eastmoney.com/a/202602063643953387.html
告别“炫技式试点” 本地化私有部署成AI规模化落地关键,【告别“炫技式试点” 本地化私有部署成AI规模化落地关键】Cloudera大中华区技术总监刘隶放对记者表示，无论是传统行业巨头还是新兴产业领军者，都纷纷将本地化私有部署作为AI规模化落地的基础架构，这一趋势不仅彰显了AI产业化的深度演进，更标志着中国AI发展从“概念炒作”迈向“硬核成果”的关键转折，为企业在AI时代构建核心竞争力奠定了坚实基础。,2026-02-06 12:50:15,https://finance.eastmoney.com/a/202602063643952448.html
汽车改装在政策“松绑”中寻求新坐标,【汽车改装在政策“松绑”中寻求新坐标】“我们下一步将大力推动全市汽车后市场体系建设，持续培育汽车改装产业。”近日，一位地方政府人士在2026新能源汽车后市场新生态大会上表示，未来将支持整车及零部件企业与改装企业等进行深度对接，加强政策研究和标准建设，依法依规为消费者提供更安全、环保、个性化的改装服务，有序推动汽车改装市场发展。,2026-02-06 12:50:00,https://finance.eastmoney.com/a/202602063643952714.html
阿童木机器人冲刺港股 2025年前三季度首次盈利,【阿童木机器人冲刺港股 2025年前三季度首次盈利】记者了解到，作为一家成立十三年的技术驱动型企业，阿童木机器人自2020年起已连续五年位居国内自主品牌并联机器人市场占有率第一，并在2023年实现了对外资品牌的全面超越。2025年前三季度，阿童木机器人首次实现账面盈利。外界关注的是，其盈利的可持续性、新兴产品的巨额亏损以及持续的现金流出，仍是冲击资本市场之路上面临的严峻考验。,2026-02-06 12:49:58,https://finance.eastmoney.com/a/202602063643952593.html
“小米、极氪对撞测试”引发公诉 高若翔涉嫌损害商品声誉案今日开庭审理,【“小米、极氪对撞测试”引发公诉 高若翔涉嫌损害商品声誉案今日开庭审理】记者从高若翔代理律师处了解到，高若翔涉嫌损害商品声誉罪一案，今日在北京市海淀区人民法院开庭审理。高若翔，即B站UP主“原来是翔翔啊”，截至发稿，该账号拥有粉丝超过百万。,2026-02-06 12:48:34,https://finance.eastmoney.com/a/202602063643952974.html
高德发布“鹰眼守护2.0” 联合中国安科院启动春运保障专项,【高德发布“鹰眼守护2.0” 联合中国安科院启动春运保障专项】2月6日消息，界面新闻记者获悉高德发布“鹰眼守护2.0”。高德按照国务院安全办公室、应急管理部工作部署，与中国安全生产科学研究院启动春运保障专项。据了解，鹰眼守护系统目前已完成春运专项升级，覆盖不同天气、车型等场景下的预警及救援服务。此外，“鹰眼报警”功能已在江苏高速率先上线。,2026-02-06 12:44:52,https://finance.eastmoney.com/a/202602063643951386.html
限制升级 阿里千问红包分享口令无法在微信内复制,【限制升级 阿里千问红包分享口令无法在微信内复制】2月6日，记者实测发现，阿里千问红包最新的分享口令在微信内已失效，页面无任何复制选项，用户无法通过微信复制口令参与千问“春节30亿免单”活动。不过，蓝鲸科技记者发现，目前元宝红包分享口令仍可在微信内复制。,2026-02-06 12:41:12,https://finance.eastmoney.com/a/202602063643951043.html
腾讯战略入股新石器无人车 大厂加码智慧物流！新战局来了,【腾讯战略入股新石器无人车 大厂加码智慧物流！新战局来了】近日，国家企业信用信息公示系统显示，新石器无人车关联公司新石器慧通（北京）科技有限公司发生工商变更，腾讯旗下广西腾讯创业投资有限公司正式新增为股东。此举成为腾讯加码AI与自动驾驶赛道、布局智慧物流场景的重要信号，是其完善AI与自动驾驶场景化落地布局的关键一步。,2026-02-06 12:38:31,https://finance.eastmoney.com/a/202602063643950859.html
印度央行将基准利率维持在5.25%不变 符合市场预期,印度央行将基准利率维持在5.25%不变，符合市场预期。,2026-02-06 12:35:32,https://finance.eastmoney.com/a/202602063643950112.html
一上午净买入超100亿港元！南向资金“扫货”港股,【一上午净买入超100亿港元！南向资金“扫货”港股】港股市场方面，上午恒生指数跌幅一度超过2%，后跌幅有所收窄。恒生指数成份股中，友邦保险、汇丰控股领跌，信义光能、药明康德、蒙牛乳业等股票表现相对较强。值得一提的是，在港股调整之际，南向资金大幅净买入，上午净买入超过100亿港元。,2026-02-06 12:30:43,https://finance.eastmoney.com/a/202602063643947577.html
云顶新耀：国家药品监督管理局已批准维适平新药上市申请,【云顶新耀：国家药品监督管理局已批准维适平新药上市申请】云顶新耀公告，中国国家药品监督管理局已批准维适平新药上市申请，在中国用于治疗对传统治疗或生物制剂应答不充分、失应答或不耐受的中度至重度活动性溃疡性结肠炎成人患者。,2026-02-06 12:28:14,https://finance.eastmoney.com/a/202602063643946059.html
港股科技板块卖空显著升温 快手卖空金额增超10倍,【港股科技板块卖空压力显著升温 快手卖空金额增超10倍】受海外情绪传导影响，港股AI应用、SaaS及游戏等科技细分领域近期承压明显，卖空活跃度持续抬升。数据显示，2023年12月底至2024年2月5日，多家代表性企业卖空规模呈阶梯式增长。,2026-02-06 12:26:21,https://finance.eastmoney.com/a/202602063643945860.html
2月6日午间新闻精选,【2月6日午间新闻精选】1、截至午间收盘，沪指涨0.11%，深证成指涨0.65%，创业板指涨0.65%。恒生指数跌1.13%，恒生科技指数跌0.47%。2、海南全省首批在海口、三亚、儋州三个地级市共开设5家日用消费品免税店，各店定于2月11日南方小年开业。,2026-02-06 12:16:08,https://finance.eastmoney.com/a/202602063643943259.html
机构：2月电视面板价格预计涨势延续 笔电面板价格承压,【机构：2月电视面板价格预计涨势延续 笔电面板价格承压】TrendForce集邦咨询日前公布2月面板价格趋势预测：2026年2月，电视面板价格预计将延续上涨态势，显示器面板部分尺寸价格上涨，笔电面板价格预期下跌。目前预估2月份电视面板价格有机会呈现全面上涨趋势，32英寸、43英寸与50英寸预估上涨1美元，55英寸、65英寸与75英寸则预计上涨2美元。,2026-02-06 12:14:49,https://finance.eastmoney.com/a/202602063643943386.html
教育部将持续推进校园餐、教辅、校服等专项整治,【教育部将持续推进校园餐、教辅、校服等专项整治】记者从2月5日至6日在河北廊坊举行的2026年度全国基础教育重点工作部署会上获悉，2026年，教育部将持续推进校园餐、教辅、校服等专项整治，加强校园餐全链条监管，严把教辅征订“入口关”，推进校服采购规范化，严查利益输送、贪腐行为，坚决维护学生和家长合法权益。,2026-02-06 12:10:42,https://finance.eastmoney.com/a/202602063643942841.html
港股午评：恒生指数跌1.13% 恒生科技指数跌0.48%,【港股午评：恒生指数跌1.13% 恒生科技指数跌0.48%】港股午间收盘，恒生指数跌1.13%，恒生科技指数跌0.48%。加密货币概念股普跌，新火科技控股跌近7%，雄岸科技跌超4%。汽车板块涨幅居前，蔚来涨逾7%，理想汽车涨超5%，零跑汽车涨近5%。,2026-02-06 12:10:11,https://finance.eastmoney.com/a/202602063643942583.html
爱尔眼科：襄阳恒泰康非爱尔眼科所属企业,【爱尔眼科：襄阳恒泰康非爱尔眼科所属企业】爱尔眼科公告，公司关注到部分媒体关于精神专科医院涉嫌违规问题的报道中，将襄阳恒泰康医院有限公司与爱尔眼科直接关联。公司现就有关情况澄清说明如下：襄阳恒泰康非爱尔眼科所属企业。该公司为爱尔医疗投资集团有限公司与其他投资方合资设立的四级子公司。襄阳恒泰康由其医院管理团队经营。爱尔医疗投资不参与襄阳恒泰康的日常经营管理。爱尔眼科与湖南恒泰康康复医疗产业发展有限公司及其下属机构不存在股权控制、业务关联或经营管理关系。,2026-02-06 12:03:52,https://finance.eastmoney.com/a/202602063643940332.html
2月6日午间涨停分析,【2月6日午间涨停分析】今日午盘全市场共47股涨停，连板股总数7只，11股封板未遂，封板率为81%（不含ST股、退市股）。焦点股方面，并购重组的湖南黄金10天7板、凯龙高科20CM3连板，影视股横店影视7天6板，名雕股份盘中上演“地天板”走出6天5板。,2026-02-06 11:55:05,https://finance.eastmoney.com/a/202602063643939417.html
2025年广东民用无人机产量同比增长39% 占全国九成以上,【2025年广东民用无人机产量同比增长39% 占全国九成以上】广东省人民政府新闻办公室2月6日举行“‘十四五’广东成就”系列主题新闻发布会，本次发布会主题为现代化产业体系建设。广东省发展和改革委员会副主任、省大湾区办常务副主任朱伟在会上表示，“十四五”期间，广东新兴产业蓬勃发展，2025年全省集成电路产量942.4亿块，比2020年增长152%；2025年人工智能核心产业规模预计达3000亿元；工业机器人、服务机器人产量均居全国第一；2025年，广东民用无人机产量同比增长39%，占全国九成以上。,2026-02-06 11:51:01,https://finance.eastmoney.com/a/202602063643938326.html
上海辖区投顾公司2025服务客户数同比增加15% 客户平均年龄52岁,【上海辖区投顾公司2025服务客户数同比增加15% 客户平均年龄52岁】上海市证券同业公会最新披露数据显示，截至2025年末，上海地区证券投资咨询机构共计31家，同比降幅6%；个人客户总数为296.32万人，同比增幅14.55%，全年净新增37.65万人，个人客户平均年龄52岁，个人客户中64.4%为大专以下学历，服务个人客户产品数相较2024年同比增幅67.87%；机构客户总数为665户，同比减少1.62%，全年净减少11个。整体来看，零售端投顾服务的活跃度提升，但投诉率持续处于较高水平，暴露出在业务规范性、服务透明度和客户适当性管理等方面仍存在改进空间。,2026-02-06 11:50:34,https://finance.eastmoney.com/a/202602063643938211.html
日本家庭“恩格尔系数”28.6% 达1981年来高位,【日本家庭“恩格尔系数”28.6% 达1981年来高位】日本总务省2月6日公布的2025年两人以上家庭收支调查结果显示，受食品价格飙升影响，显示食品支出占家庭消费支出比重的“恩格尔系数”为28.6%，达到1981年以来的新高。消费支出显示，学费等“教育”增加6.8%，包括汽车相关费用在内的“交通和通信”增长6.7%。由于酷暑导致空调使用频率增加，“水电燃气”支出也增加2.5%。受食品价格大涨影响，节约食品消费的趋势蔓延，食品支出下降1.2%，点心类以及大米、面包等谷物类消费也减少。,2026-02-06 11:46:52,https://finance.eastmoney.com/a/202602063643937286.html
迈为股份半导体晶圆热压键合设备交付MEMS传感器头部企业,【迈为股份半导体晶圆热压键合设备交付MEMS传感器头部企业】近日，迈为股份自主研发的半导体晶圆热压键合设备成功交付国内MEMS传感器头部企业，该批设备将应用于客户先进MEMS传感器的规模化生产线。,2026-02-06 11:44:51,https://finance.eastmoney.com/a/202602063643937176.html
服务器卡爆了！千问APP已送出超100万单奶茶 阿里：正紧急加资源,【服务器卡爆了！千问APP已送出超100万单奶茶 阿里：正紧急加资源】记者实测体验发现，在下单过程中，千问APP多次出现卡顿现象。页面提示：活动太火爆了，请稍后再试。 对此阿里方面回应《科创板日报》称：“我们正在紧急加资源，全力保障顺畅。”,2026-02-06 11:37:43,https://finance.eastmoney.com/a/202602063643934524.html
创业板指上涨0.65% 化工股涨幅居前 珠宝首饰板块走强,【午盘播报】沪指上涨0.11%，报4080.31点；深成指上涨0.65%，报14043.17点；创业板指上涨0.65%，报3281.45点，两市半日合计成交13842亿。盘面上，珠宝首饰、环氧丙烷、氟化工、机器人执行器、采掘行业、能源金属、电池、化工原料涨幅居前，免税概念、酿酒行业、商业百货、旅游酒店、船舶制造、航空机场表现不佳，领跌市场。全市场上涨个股有3852家，下跌个股有1454家，51只股涨停。,2026-02-06 11:30:54,https://finance.eastmoney.com/a/202602063643931865.html
泰国期货交易所（TFEX）宣布暂停白银在线期货的临时交易,泰国期货交易所（TFEX）宣布暂停白银在线期货的临时交易。,2026-02-06 11:30:07,https://finance.eastmoney.com/a/202602063643931094.html
董明珠接受人民日报专访：现在的年轻人要有耐心要吃得起亏,【董明珠接受人民日报专访：现在的年轻人要有耐心要吃得起亏】董明珠表示，年轻人要有耐心，要吃得起亏。有人认为拿了文凭就应该坐到一个高级岗位上去，即使给你一个高级岗位，你不能掌控，或者不能更深层次地发现问题、组织新的创新模式，也没有用。,2026-02-06 11:28:10,https://finance.eastmoney.com/a/202602063643930835.html
睿能科技旗下贝能国际与英飞凌推出机器人关节驱动的一站式解决方案,【睿能科技旗下贝能国际与英飞凌推出机器人关节驱动的一站式解决方案】睿能科技(603933)旗下贝能国际官微消息，贝能与英飞凌科技联合推出了一款高集成度解决方案——基于英飞凌PSOCControlC3MCU微控制器和高效GaN功率器件的400W机器人关节电机驱动方案，涵盖主控、功率、传感与架构。该方案为工程师提供了一个经过验证的高性能起点，旨在大幅缩短研发周期、加速产品上市进程。,2026-02-06 11:27:04,https://finance.eastmoney.com/a/202602063643930039.html
南向资金净买入超100亿港元,截至目前，南向资金净买入超100亿港元。,2026-02-06 11:25:12,https://finance.eastmoney.com/a/202602063643928789.html
特斯拉产线转产Optimus机器人，机器人ETF鹏华涨超2%,【特斯拉产线转产Optimus机器人，机器人ETF鹏华涨超2%】机器人概念盘中震荡回升，消息面上，马斯克表示，公司将把位于加州弗里蒙特工厂中原本用于生产ModelS与ModelX的产线，转为Optimus人形机器人专用制造设施。,2026-02-06 11:24:58,https://finance.eastmoney.com/a/202602063643937317.html
大族数控实现“A+H”上市 H股早盘一度涨近19%,【大族数控实现“A+H”上市 H股早盘一度涨近19%】2月6日，大族数控正式登陆港交所，最终发售价为95.80港元/股，募资总额为48.33亿港元。上市首日开盘，大族数控H股一度涨近19%，最高报114港元/股。截至10时47分，大族数控H股报111.1港元/股，涨15.97%。,2026-02-06 11:23:48,https://finance.eastmoney.com/a/202602063643927992.html
大宗商品ETF(510170)强势翻红涨超1%，1月中国大宗商品价格指数创近三年半来新高,【大宗商品ETF(510170)强势翻红涨超1%，1月中国大宗商品价格指数创近三年半来新高】截至2026年2月6日11:06，大宗商品ETF(510170)上涨1.07%，盘中换手3.1%，成交1793.23万元。成分股厦门钨业上涨4.12%，南山铝业上涨3.79%，中国铝业上涨3.24%，金钼股份上涨3.19%，梅花生物上涨3.17%。,2026-02-06 11:21:49,https://finance.eastmoney.com/a/202602063643927476.html
美国国债收益率曲线升至近四年来最陡水平,【美国国债收益率曲线升至近四年来最陡水平】美国国债收益率曲线升至近四年来最陡水平。受降息预期升温、对通胀持续性的担忧以及财政赤字压力影响，美国10年期国债与2年期国债收益率利差一度扩大至73.7个基点，接近2025年4月触及的73.8个基点高位，为2022年1月以来最高水平。,2026-02-06 11:18:25,https://finance.eastmoney.com/a/202602063643925118.html
黄金持续震荡 还能涨吗？中信证券敖翀：金价上涨趋势并没有完结,【黄金持续震荡 还能涨吗？中信证券敖翀：金价上涨趋势并没有完结】近日，针对当前黄金市场的剧烈波动与后续走向，记者特别对话了中信证券有色金属行业首席分析师敖翀，试图厘清本轮行情的核心驱动，探寻价格剧烈波动的背后逻辑。在交流中，敖翀明确指出，当前黄金的上涨趋势尚未完结，流动性预期是当下驱动黄金价格走势的核心力量。此外，持续的地缘政治冲突也为黄金提供了阶段性的避险动力。,2026-02-06 11:18:17,https://finance.eastmoney.com/a/202602063643925723.html
卓正医疗登陆港交所 开盘涨超35%,【卓正医疗登陆港交所 开盘涨超35%】2月6日，卓正医疗在港交所挂牌上市，开盘报81港元/股，上涨35%。招股书显示，卓正医疗成立于2012年，在战略上专注于服务中高端医疗服务市场，以通常具有较强购买力、偏好更个性化医疗服务的大众富裕人群为目标客户。,2026-02-06 11:17:29,https://finance.eastmoney.com/a/202602063643926292.html
包装印刷板块盘中走强 京华激光涨停,包装印刷板块盘中走强，京华激光涨停，金富科技此前涨停，大胜达、天元股份、嘉美包装等股跟涨。,2026-02-06 11:16:12,https://finance.eastmoney.com/a/202602063643924632.html
牧原股份港股发行获超额认购 成为国内生猪养殖业首家“A+H”企业,【牧原股份港股发行获超额认购 成为国内生猪养殖业首家“A+H”企业】2月6日，牧原股份（02714.HK）在港交所上市，正式迈入“A+H”双资本平台发展阶段。若超额配售权悉数行使，牧原股份本次发行净额最高可达120.38亿港元，这不仅是2026年以来全球规模最大的农牧企业IPO，更跻身港股农业板块近年最大规模IPO之列，彰显了全球资本市场对中国生猪养殖龙头企业的高度认可。,2026-02-06 11:14:02,https://finance.eastmoney.com/a/202602063643922954.html
上海经信委组织开展2026年安全应急装备应用推广典型案例推荐工作 重点鼓励人工智能、5G等创新应用,【上海经信委组织开展2026年安全应急装备应用推广典型案例推荐工作 重点鼓励人工智能、5G等创新应用】上海市经济信息化委发布《关于组织开展2026年安全应急装备应用推广典型案例推荐工作的通知》。其中提出，本次案例推荐覆盖三大核心场景，聚焦七大装备类型，重点鼓励人工智能、5G等新一代信息技术赋能的创新应用。,2026-02-06 11:11:13,https://finance.eastmoney.com/a/202602063643921522.html
花旗：Arm仍具强劲成长动能与成长股特质 目标价下调至190美元,【花旗：Arm仍具强劲成长动能与成长股特质 目标价下调至190美元】花旗发表报告指，软银旗下英国芯片设计商Arm去年12月底止2026财年第三季营收与盈利略胜预期。基于云端AI整体潜在市场(TAM)规模增长及CSS技术普及，该行将Arm 2026和2027财年营收预测各上调1%，预期营收将实现23%和21%的强劲增长；目标价由200美元降至190美元，评级“买入”。,2026-02-06 11:09:20,https://finance.eastmoney.com/a/202602063643920335.html
