标题,摘要,发布时间,链接
现货铂金跌超20% 目前报约2100美元/盎司,现货铂金跌超20%，目前报约2100美元/盎司。,2026-01-31 02:15:38,https://finance.eastmoney.com/a/202601313637443437.html
现货白银向下跌破82美元/盎司 日内下跌29.46%,现货白银向下跌破82美元/盎司，日内下跌29.46%。现货黄金向下跌破4800美元，日内下跌10.76%。,2026-01-31 02:11:55,https://finance.eastmoney.com/a/202601313637442529.html
哥伦比亚中央银行将贷款利率上调至10.25% 此前为9.25%,哥伦比亚中央银行将贷款利率上调至10.25%，此前为9.25%。,2026-01-31 02:06:42,https://finance.eastmoney.com/a/202601313637441834.html
美国本周石油钻井总数411口 前值411口,美国本周石油钻井总数411口，前值411口。,2026-01-31 02:01:54,https://finance.eastmoney.com/a/202601313637441715.html
受严寒天气影响 美载人绕月飞行任务被推迟,【受严寒天气影响 美载人绕月飞行任务被推迟】美国国家航空航天局表示，受发射场接近冰点的低温天气影响，已决定推迟“阿耳忒弥斯”计划的首次载人绕月任务。据悉，原定进行的关键火箭加注测试因寒冷天气被取消，“阿耳忒弥斯2号”任务的发射时间调整为不早于2月8日，较原计划推迟两天。美国国家航空航天局表示，如再出现延误，发射窗口将按天顺延，任务时间可能被推入3月。,2026-01-31 02:01:21,https://finance.eastmoney.com/a/202601313637441667.html
纳斯达克中国金龙指数跌幅扩大 现跌2.0%,纳斯达克中国金龙指数跌幅扩大，现跌2.0%，最新报7760.17点。,2026-01-31 02:00:28,https://finance.eastmoney.com/a/202601313637441568.html
现货白银向下跌破85美元/盎司 日内下跌26.48%,现货白银向下跌破85美元/盎司，日内下跌26.48%。,2026-01-31 01:56:37,https://finance.eastmoney.com/a/202601313637441444.html
LME期铜收跌460美元,【LME期铜收跌460美元】LME期铜收跌460美元，报13158美元/吨。LME期铝收跌74美元，报3144美元/吨。LME期锌收跌10美元，报3402美元/吨。LME期铅收跌5美元，报2009美元/吨。LME期镍收跌415美元，报17954美元/吨。LME期锡收跌3129美元，报51955美元/吨。LME期钴收平，报56290美元/吨。,2026-01-31 01:55:52,https://finance.eastmoney.com/a/202601313637441337.html
现货白银重挫25% 现货黄金跌超10%,【现货白银重挫25% 现货黄金跌超10%】贵金属市场突现资金踩踏式出逃，现货白银日内跌幅扩大至25%，报86.69美元/盎司。现货黄金报4839美元/盎司，日内下跌超10%。,2026-01-31 01:53:20,https://finance.eastmoney.com/a/202601313637441173.html
现货白银日内跌幅扩大至23% 报89.2美元/盎司,现货白银日内跌幅扩大至23%，报89.2美元/盎司。,2026-01-31 01:41:49,https://finance.eastmoney.com/a/202601313637438917.html
现货黄金向下跌破4900美元 日内下跌8.88%,现货黄金向下跌破4900美元，日内下跌8.88%。,2026-01-31 01:32:31,https://finance.eastmoney.com/a/202601313637437580.html
证监会：全力巩固资本市场稳中向好势头,【证监会：全力巩固资本市场稳中向好势头】1月30日，证监会党委书记、主席吴清召开座谈会，与部分境内外上市公司代表深入交流，充分听取意见建议。吴清表示，上市公司是资本市场之基，要专注主业、完善治理，努力提升发展质量，增强回报投资者能力，为资本市场高质量发展提供坚实支撑。,2026-01-31 01:32:28,https://finance.eastmoney.com/a/202601313637438396.html
普京会见伊朗最高领袖顾问,【普京会见伊朗最高领袖顾问】据CCTV国际时讯报道，俄罗斯总统新闻秘书佩斯科夫当地时间1月30日称，俄罗斯总统普京在克里姆林宫会见了伊朗最高领袖哈梅内伊的顾问阿里·拉里贾尼。,2026-01-31 01:30:18,https://finance.eastmoney.com/a/202601313637437224.html
特朗普在谈到美国司法部对鲍威尔的调查时表示：翻新工程不是无能就是盗窃,特朗普在谈到美国司法部对鲍威尔的调查时表示，（美联储总部）翻新工程不是无能就是盗窃。,2026-01-31 01:27:01,https://finance.eastmoney.com/a/202601313637437048.html
国际油价跌超1%,【国际油价跌超1%】布伦特原油期货跌幅扩大至1%，报68.846美元/桶。WTI原油期货跌幅扩大至1%，报64.707美元/桶。,2026-01-31 01:25:55,https://finance.eastmoney.com/a/202601313637436959.html
美国总统特朗普表示：沃什并未承诺降息 但他想要降息,美国总统特朗普表示，沃什并未承诺降息，但他想要降息。要求沃什降息可能不太合适。,2026-01-31 01:20:04,https://finance.eastmoney.com/a/202601313637436677.html
现货白银向下跌破91美元/盎司 日内下跌21.29%,现货白银向下跌破91美元/盎司，日内下跌21.29%。,2026-01-31 01:13:45,https://finance.eastmoney.com/a/202601313637436529.html
沪银期货主力合约日内触及跌停,【沪银期货主力合约日内触及跌停】沪银期货主力合约日内触及跌停，报24832元/千克，跌幅17%。,2026-01-31 01:12:19,https://finance.eastmoney.com/a/202601313637436425.html
道指跌幅扩大至1% 纳指跌0.9%,道指跌幅扩大至1%，纳指跌0.9%。,2026-01-31 01:06:53,https://finance.eastmoney.com/a/202601313637435716.html
沪铜夜盘收跌超4.7%,【沪铜夜盘收跌超4.7%】国际铜夜盘收跌4.60%，沪铜收跌4.75%，沪铝收跌2.82%，沪锌收跌2.07%，沪铅收跌0.79%，沪镍收跌3.75%，沪锡收跌6.56%。氧化铝夜盘收涨1.04%，铝合金收跌2.60%。不锈钢夜盘收跌3.05%。,2026-01-31 01:03:16,https://finance.eastmoney.com/a/202601313637435629.html
“伊斯兰国”宣称对尼日尔首都机场遭袭事件负责,【“伊斯兰国”宣称对尼日尔首都机场遭袭事件负责】极端组织“伊斯兰国”在当地时间1月30日的一份声明中宣称对尼日尔首都机场遭袭事件负责。尼日尔国防部29日晚宣布，首都尼亚美迪奥里·哈马尼国际机场区域当天遭到“恐怖袭击”，尼国防与安全部队进行反击，打死至少20名雇佣兵，并抓获11人。,2026-01-31 00:58:46,https://finance.eastmoney.com/a/202601313637435568.html
美国天然气3月合约涨幅扩大至10%,美国天然气3月合约涨幅扩大至10%。,2026-01-31 00:58:06,https://finance.eastmoney.com/a/202601313637435425.html
现货白银日内跌幅扩大至20% 报92.13美元/盎司,现货白银日内跌幅扩大至20%，报92.13美元/盎司。,2026-01-31 00:52:04,https://finance.eastmoney.com/a/202601313637434375.html
新任美联储主席提名人选 为什么是他？,【新任美联储主席提名人选 为什么是他？】新任美联储主席提名人选终于揭晓。据新华社报道，美国总统特朗普30日提名美联储前理事凯文·沃什为下任美联储主席，这一提名还需获得参议院批准。消息传出后，市场震荡。1月30日美股盘前，美股股指期货集体下挫。,2026-01-31 00:44:09,https://finance.eastmoney.com/a/202601303637443233.html
欧洲主要股指收盘集体上涨,【欧洲主要股指收盘集体上涨】欧洲主要股指收盘集体上涨，德国DAX30指数涨幅1.11%，报24562.02点；英国富时100指数涨幅0.56%，报10228.90点；法国CAC40指数涨幅0.68%，报8126.53点；欧洲斯托克50指数涨幅1.00%，报5950.66点。,2026-01-31 00:43:37,https://finance.eastmoney.com/a/202601313637431132.html
现货白银日内跌幅扩大至19% 报93.41美元/盎司,现货白银日内跌幅扩大至19%，报93.41美元/盎司。,2026-01-31 00:39:11,https://finance.eastmoney.com/a/202601313637430652.html
现货白银日内跌幅扩大至18% 报94.32美元/盎司,现货白银日内跌幅扩大至18%，报94.32美元/盎司。,2026-01-31 00:35:46,https://finance.eastmoney.com/a/202601313637430468.html
排队抢金与理性观望交织 实探北京菜百黄金投资群像,【排队抢金与理性观望交织 实探北京菜百黄金投资群像】寒风料峭的北京冬日清晨，位于西城区的北京菜市口百货股份有限公司门前已人头攒动、暖意渐生。《证券日报》记者注意到，彼时距离门店开门营业还有一段时间，但已有数十位投资者裹着厚外套在门外排队，只为尽早入场选购中意的黄金类商品。,2026-01-31 00:35:13,https://finance.eastmoney.com/a/202601313637476628.html
美联储理事米兰表示：美国目前不存在通胀问题,【美联储理事米兰表示：美国目前不存在通胀问题】美联储理事米兰表示，美国目前不存在通胀问题；美国失业率大约偏高0.5个百分点；不认为PPI对PCE预期产生了实质性影响。,2026-01-31 00:34:24,https://finance.eastmoney.com/a/202601313637430351.html
美国参议院少数党领袖舒默表示：如果美国司法部不撤销针对美联储主席鲍威尔的调查行动 那么共和党人就不得推进沃什的提名事宜,美国参议院少数党领袖舒默表示，如果美国司法部不撤销针对美联储主席鲍威尔的调查行动，那么共和党人就不得推进沃什的提名事宜。,2026-01-31 00:33:06,https://finance.eastmoney.com/a/202601313637430270.html
美联储理事米兰：放松管制将使美联储能够缩减资产负债表,【美联储理事米兰：放松管制将使美联储能够缩减资产负债表】美联储理事米兰表示，认为美联储官员会欢迎沃什。必须继续积极推进监管规模优化，放松管制将使美联储能够缩减资产负债表。美联储的预测可以实现现代化。,2026-01-31 00:28:34,https://finance.eastmoney.com/a/202601313637429922.html
世界气象组织：2026年1月全球极端天气频发造成严重损失,【世界气象组织：2026年1月全球极端天气频发造成严重损失】世界气象组织30日发布新闻公报说，今年1月，高温及其引发的火灾、低温和降雪、暴雨和洪水等极端天气事件影响了全球多国，造成严重的经济、环境和人员损失，这再次凸显了加大对天气预警系统投资的重要性。,2026-01-31 00:25:15,https://finance.eastmoney.com/a/202601313637429885.html
美国宣布对伊朗最新制裁措施,【美国宣布对伊朗最新制裁措施】当地时间1月30日，美国财政部下属外国资产控制办公室发布公告，更新与伊朗相关的反恐、反扩散制裁名单，将多名伊朗伊斯兰革命卫队及执法系统高层个人列入“特别指定国民清单”（SDN清单）。,2026-01-31 00:22:41,https://finance.eastmoney.com/a/202601313637429733.html
欧盟考虑以服务禁令取代对俄罗斯石油价格的上限,欧盟考虑以服务禁令取代对俄罗斯石油价格的上限。,2026-01-31 00:13:36,https://finance.eastmoney.com/a/202601313637429677.html
礼来制药计划在美国宾夕法尼亚州工厂开支35亿美元 用于生产下一代减肥药,礼来制药计划在美国宾夕法尼亚州工厂开支35亿美元，用于生产下一代减肥药。,2026-01-31 00:09:12,https://finance.eastmoney.com/a/202601313637428956.html
16宗IPO审理暂停！香港证监会、港交所最新回应！,【16宗IPO审理暂停！香港证监会、港交所最新回应！】1月30日，香港证券及期货事务监察委员会发出通函，表示高度关注在2025年新上市申请激增期间出现的问题，包括部分上市文件的拟备工作存在严重缺失，保荐人或有失当行为，以及其资源管理严重失误。,2026-01-31 00:01:15,https://finance.eastmoney.com/a/202601303637654677.html
缅甸巩发党获省邦议会多数席位,【缅甸巩发党获省邦议会多数席位】缅甸联邦选举委员会当地时间1月30日晚公布大选投票第三阶段省邦议会获选议员名单。根据最新数据，在选举产生的369个省邦议会民选议席中，缅甸联邦巩固与发展党（巩发党）共计获得265个席位，大幅领先其他政党。,2026-01-30 23:55:03,https://finance.eastmoney.com/a/202601303637423717.html
中钢协：2026年继续推进产能治理新机制 着力“控总量、优供给、促平稳、增效益、推转型”,【中钢协：2026年继续推进产能治理新机制 着力“控总量、优供给、促平稳、增效益、推转型”】中国钢铁工业协会第十三次会员大会在北京召开。钢协会长赵民革指出，“十五五”时期，钢铁工业要朝着2030年全面建成全球影响力大、产业独立性强、发展贡献度高的现代化钢铁产业体系的目标稳步前行。2026年是“十五五”开局之年，钢铁行业将坚定信心、向新向优，围绕“1231”行业发展目标，深入实施“提质创品”“能碳提效”“数智转型”三大改造工程，继续推进产能治理新机制、联合重组、“铁资源开发计划”、“钢铁应用拓展计划”，着力“控总量、优供给、促平稳、增效益、推转型”，为实现钢铁工业“十五五”高质量发展开好局、起好步。,2026-01-30 23:53:03,https://finance.eastmoney.com/a/202601303637423483.html
摩根大通开始出售200亿美元EA收购债券中的一部分,摩根大通开始出售200亿美元EA收购债券中的一部分。,2026-01-30 23:49:47,https://finance.eastmoney.com/a/202601303637422951.html
盘后A股上市公司重点业绩公告精选,【盘后A股上市公司重点业绩公告精选】据财联社不完全统计，截至发稿，盘后包括中国神华、中际旭创、寒武纪、新易盛、山东黄金、中国国航、中金公司、中国东航、三六零、海航控股、昆仑万维、上纬新材、广东明珠、菱电电控、博杰股份、科兴制药、湘财股份、同洲电子、志特新材、西部黄金、航天发展、闻泰科技、天地在线、华侨城A、长春高新、深康佳A等多家A股上市公司发布2025年业绩预告。其中，寒武纪公告，2025年预盈18亿元-21亿元。新易盛公告，2025年净利同比预增231%-249%，中际旭创公告，2025年净利同比预增89%-128%。,2026-01-30 23:48:58,https://finance.eastmoney.com/a/202601303637422668.html
快手旗下子公司存多个违法行为 被罚款超2600万元,【快手旗下子公司存多个违法行为 被罚款超2600万元】国家市场监督管理总局集中发布第五批直播电商领域典型案例，成都快购科技有限公司被罚2669.29万元。成都快购科技成立于2019年10月31日，注册资本为5000万元，北京快手科技有限公司持有成都快购科技100%股权。,2026-01-30 23:48:04,https://finance.eastmoney.com/a/202601303637422228.html
波兰电子游戏开发商CD PROJEKT在华沙的股价跌幅高达7.4%,波兰电子游戏开发商CD PROJEKT在华沙的股价跌幅高达7.4%。,2026-01-30 23:41:44,https://finance.eastmoney.com/a/202601303637417959.html
伊朗最高领袖顾问：欧盟国家军队将被视为恐怖组织,【伊朗最高领袖顾问：欧盟国家军队将被视为恐怖组织】伊朗最高领袖顾问阿里·拉里贾尼30日说，凡参与欧盟近期针对伊朗伊斯兰革命卫队相关决定的国家，其军队将被视为恐怖组织。拉里贾尼当天在社交媒体上发文说：“根据伊朗伊斯兰议会通过的决议，凡参与欧盟近期针对伊朗伊斯兰革命卫队相关决定的国家，其军队将被视为恐怖组织。由此产生的后果将由采取这一行动的欧洲国家自行承担。”,2026-01-30 23:39:51,https://finance.eastmoney.com/a/202601303637416235.html
商务部新闻发言人就中国诉美《通胀削减法》世贸争端案专家组发布裁决答记者问,【商务部新闻发言人就中国诉美《通胀削减法》世贸争端案专家组发布裁决答记者问】有记者问：据悉，世贸组织专家组就中国诉美《通胀削减法》世贸争端案发布裁决，美国涉案措施被裁违反世贸规则。请问发言人对此有何评论？答：日内瓦当地时间1月30日，世贸组织公布中国诉美《通胀削减法》世贸争端案专家组裁决。本案专家组裁定，美涉案清洁能源补贴措施违反世贸组织规则，驳回美所谓涉案措施是为保护美“公共道德”进行的抗辩，要求美取消涉案补贴措施。中方对专家组作出的客观、公正裁决表示欢迎和赞赏。中方始终是世贸组织规则的坚定守护者、国际经贸秩序的坚定捍卫者。我们希望美方尊重专家组裁决，尊重世贸组织规则，尽快采取措施纠正错误做法，以实际行动维护国际经贸秩序，推动国际贸易稳定有序发展。,2026-01-30 23:34:37,https://finance.eastmoney.com/a/202601303637412878.html
特斯拉涨超4%,特斯拉涨超4%。SpaceX正在考虑与特斯拉进行潜在的合并，同时也在评估另一种方案——与人工智能公司xAI进行整合。,2026-01-30 23:31:31,https://finance.eastmoney.com/a/202601303637410316.html
白宫顾问哈塞特表示：供给侧繁荣将让美联储有空间降息,白宫顾问哈塞特表示，供给侧繁荣将让美联储有空间降息；强势美元是美国财政部的政策。,2026-01-30 23:28:07,https://finance.eastmoney.com/a/202601303637404222.html
哈塞特对“落选美联储主席”不感到失望 抨击美联储1月按兵不动,【哈塞特对“落选美联储主席”不感到失望 抨击美联储1月按兵不动】白宫顾问哈塞特表示，并不对“没有被美国总统特朗普提名为美联储主席”感到失望。哈塞特称，高度尊重（美联储主席提名人）凯文·沃什，将想方设法推动（国会参议院）确认对他提名资格的确认。白宫相信，沃什的提名资格应该迅速得到（立法机构的）确认。美联储1月份没有降息是一个错误。,2026-01-30 23:27:08,https://finance.eastmoney.com/a/202601303637400952.html
科磊大跌11%,科磊大跌11%。科磊第二财季业绩全面超预期，但下季度业绩指引增长放缓，瑞银将其目标价从1635美元下调至1575美元。,2026-01-30 23:24:37,https://finance.eastmoney.com/a/202601303637395510.html
非盟主席关注埃塞俄比亚提格雷地区局势 呼吁各方保持克制,【非盟主席关注埃塞俄比亚提格雷地区局势 呼吁各方保持克制】当地时间1月30日，非盟委员会主席优素福表示密切关注埃塞俄比亚提格雷地区局势发展，呼吁各方保持克制。优素福强调，埃塞俄比亚联邦政府与“提格雷人民解放阵线”2022年11月2日在南非比勒陀利亚签署“永久停止敌对行动”协议，所取得的成果来之不易、至关重要，必须继续维护。非盟重申其对全面有效执行常设人事委员会的坚定承诺，并重申将继续支持各方开展和平建设与和解进程。,2026-01-30 23:23:27,https://finance.eastmoney.com/a/202601303637391956.html
伊朗外长：伊美谈判应在公平、平等的前提下进行,【伊朗外长：伊美谈判应在公平、平等的前提下进行】伊朗外长阿拉格齐30日说，伊朗不会在美国威胁下进行谈判，谈判应在公平、平等的前提下进行。伊朗目前没有与美国进行谈判的具体计划。,2026-01-30 23:18:31,https://finance.eastmoney.com/a/202601303637381625.html
美国财政部制裁两个据称与伊朗伊斯兰革命卫队相关的实体,美国财政部制裁两个据称与伊朗伊斯兰革命卫队相关的实体。,2026-01-30 23:14:47,https://finance.eastmoney.com/a/202601303637381216.html
库迪咖啡：2月起自有平台内非特价产品按零售价售卖,【库迪咖啡：2月起自有平台内非特价产品按零售价售卖】有消息称，库迪咖啡发布门店价格策略和活动调整通知。通知指出，“全场9.9元不限量”活动将于2026年1月31日24时正式结束，2026年2月1日0时起，将开启特价专区，部分产品仍然延续9.9元不限量。2026年2月1日0时起，库迪自有平台内非特价活动产品，均按零售价售卖。库迪咖啡方面回应称，属实。库迪咖啡相关负责人表示，部分产品延续特价9.9元不限量，全线产品持续参与外卖平台各类补贴活动。,2026-01-30 23:13:47,https://finance.eastmoney.com/a/202601303637381031.html
美国股市早盘延续跌势 交易员料沃什最终并不会支持深度降息,【美国股市早盘延续跌势 交易员料沃什最终并不会支持深度降息】美国股市周五早盘延续跌势，交易员押注特朗普所挑选的美联储下一任主席凯文·沃什最终将不支持深度降息，且对通胀更为忧心。虽然沃什曾响应特朗普的降息号召，并支持改革美联储，但由于沃什在美联储任职期间对于通胀上行所表达的担忧，交易员认为他最终会更倾向于防止物价压力的攀升。,2026-01-30 23:12:03,https://finance.eastmoney.com/a/202601303637380123.html
国寿资产公司合并管理资产规模突破7万亿元,【国寿资产公司合并管理资产规模突破7万亿元】国寿资产公司召开2026年工作会议。会议信息显示，2025年末该公司合并管理资产总规模6.93万亿元，其中合并管理第三方业务规模超9500亿元。截至2026年1月末，该公司合并管理资产总规模进一步突破7万亿元。,2026-01-30 23:10:33,https://finance.eastmoney.com/a/202601303637379797.html
"南非主要股指下跌4.2% 至120,045.70点","南非主要股指下跌4.2%，至120,045.70点。",2026-01-30 23:09:55,https://finance.eastmoney.com/a/202601303637379622.html
国内部分商品期货夜盘收盘 化工板块走强,【国内部分商品期货夜盘收盘 化工板块走强】国内部分商品期货夜盘收盘，BR橡胶跌超2%，橡胶、20号胶跌超1%，苯乙烯、PTA、瓶片、白糖、对二甲苯小幅下跌。烧碱、PVC涨超2%，焦煤、纯碱涨超1%。,2026-01-30 23:07:51,https://finance.eastmoney.com/a/202601303637379585.html
纳斯达克中国金龙指数跌幅扩大至1%,纳斯达克中国金龙指数跌幅扩大至1%。,2026-01-30 23:06:38,https://finance.eastmoney.com/a/202601303637379486.html
美元兑日元汇率上升1%至154.66,美元兑日元汇率上升1%至154.66。,2026-01-30 23:05:46,https://finance.eastmoney.com/a/202601303637379364.html
利弗莫尔证券显示：钛和检测认证集团股份有限公司向港交所提交上市申请书,利弗莫尔证券显示，钛和检测认证集团股份有限公司向港交所提交上市申请书。独家保荐人为光大证券国际。,2026-01-30 23:04:42,https://finance.eastmoney.com/a/202601303637379114.html
利弗莫尔证券显示：台铃科技股份有限公司向港交所提交上市申请书,利弗莫尔证券显示，台铃科技股份有限公司向港交所提交上市申请书，联合保荐人为中信证券和招商证券国际。,2026-01-30 22:52:46,https://finance.eastmoney.com/a/202601303637374544.html
高露洁盘初涨逾6%,【高露洁盘初涨逾6%】高露洁盘初涨逾6%。消息面上，高露洁报告称，截至12月31日的季度净销售额为52.3亿美元，高于一年前的49.4亿美元。,2026-01-30 22:51:58,https://finance.eastmoney.com/a/202601303637374186.html
美国1月份MNI芝加哥商业景气指数报54.0 预估43.7,美国1月份MNI芝加哥商业景气指数报54.0，预估43.7。,2026-01-30 22:49:27,https://finance.eastmoney.com/a/202601303637372522.html
杭州土拍迎来“开门红”：浙系民企火爆抢地 溢价率近20%,【杭州土拍迎来“开门红”：浙系民企火爆抢地 溢价率近20%】杭州2026年首场宅地土拍火热收官。本土房企浙江博策经过30轮激烈竞价，以8.77亿元总价成功竞得拱墅区东新单元优质地块，成交楼面价33515元/平方米，溢价率达19.81%。,2026-01-30 22:48:50,https://finance.eastmoney.com/a/202601303637372243.html
利弗莫尔证券显示：卡奥斯物联科技股份有限公司向港交所提交上市申请书,利弗莫尔证券显示，卡奥斯物联科技股份有限公司向港交所提交上市申请书，联合保荐人为中金公司和汇丰银行。,2026-01-30 22:47:04,https://finance.eastmoney.com/a/202601303637372180.html
风语筑：实控人李晖拟减持不超3%公司股份,【风语筑：实控人李晖拟减持不超3%公司股份】风语筑(603466.SH)公告称，持股21.23%的实控人李晖，拟通过集中竞价交易方式减持不超过594.79万股公司股份、通过大宗交易方式减持不超过1189.57万股公司股份，即合计不超过公司总股本的3%。,2026-01-30 22:43:15,https://finance.eastmoney.com/a/202601303637369870.html
利弗莫尔证券显示：江苏中鑫家居新材料股份有限公司向港交所提交上市申请书,利弗莫尔证券显示，江苏中鑫家居新材料股份有限公司向港交所提交上市申请书，独家保荐人为农银国际。,2026-01-30 22:42:21,https://finance.eastmoney.com/a/202601303637369767.html
利弗莫尔证券显示：广州鹏辉能源科技股份有限公司向港交所提交上市申请书,利弗莫尔证券显示，广州鹏辉能源科技股份有限公司向港交所提交上市申请书，独家保荐人为中信证券。,2026-01-30 22:40:35,https://finance.eastmoney.com/a/202601303637368784.html
庞巴迪股价一度下跌11% 创去年4月4日以来最大跌幅,庞巴迪股价一度下跌11%，创去年4月4日以来最大跌幅。,2026-01-30 22:37:30,https://finance.eastmoney.com/a/202601303637366748.html
美光科技涨超3% 本月累涨超57%,美光科技涨超3%，本月累涨超57%，市值首次突破5000亿美元。,2026-01-30 22:36:52,https://finance.eastmoney.com/a/202601303637366153.html
