标题,摘要,发布时间,链接
美参议院通过为联邦政府大部分部门提供资金的支出法案,【美参议院通过为联邦政府大部分部门提供资金的支出法案】当地时间30日，美国参议院通过了为联邦政府大部分部门提供资金的支出法案，并将该法案提交众议院审议。,2026-01-31 08:01:48,https://finance.eastmoney.com/a/202601313637643796.html
A股战略投资规则迎十条大修 强化中长期资金入市红利,【A股战略投资规则迎十条大修 强化中长期资金入市红利】证监会就修改《证券期货法律适用意见第18号》公开征求意见，引发关注。这次修订核心指向扩大战略投资者范围、明确持股要求，为中长期资金入市筑牢制度根基。这场规则将调整如何划定战略投资者的边界？又将为上市公司再融资与资本市场生态带来哪些变化？,2026-01-31 08:01:28,https://finance.eastmoney.com/a/202601313637643965.html
代号“精灵” 谷歌首次开放世界模型 AI加速进入“凭空造世”时代,【代号“精灵” 谷歌首次开放世界模型 AI加速进入“凭空造世”时代】如果人工智能领域的进步可以看作一部交响乐，那么过去几年，乐章的主题无疑是“生成”——生成文字、图像、声音乃至视频。然而，在2026年初，一段崭新的旋律被奏响：它不仅生成，更能构建。,2026-01-31 07:58:02,https://finance.eastmoney.com/a/202601313637643612.html
英伟达和OpenAI之间价值1000亿美元的合作交易谈判陷入停滞,英伟达和OpenAI之间价值1000亿美元的合作交易谈判陷入停滞。,2026-01-31 07:52:42,https://finance.eastmoney.com/a/202601313637643170.html
SpaceX去年营收据悉约为150-160亿美元,【SpaceX去年营收据悉约为150-160亿美元】当地时间1月30日，据报道，两名知情人士透露，SpaceX去年营收约150亿至160亿美元，实现利润约80亿美元。报道称，星链业务是主要收入增长动力。,2026-01-31 07:51:11,https://finance.eastmoney.com/a/202601313637631513.html
公募基金信披规则迎重大修订 要求新增产品中长期业绩 不再披露过去1个月的业绩,【公募基金信披规则迎重大修订 要求新增产品中长期业绩 不再披露过去1个月的业绩】在本次可拓展商业报告语言（XBRL）模板中，证监会要求，基金管理人在年报中披露报告期内相关产品的股票换手率数据，强化投资行为稳定性的信息揭示，督促基金管理人、基金经理形成更加审慎、理性的投资观念，纠治过于激进的投资行为；基金业协会要求，管理人在年报、半年报、季报中新增产品过去7、10年中长期业绩，不再披露过去1个月的业绩，引导行业更加注重“长期投资、价值投资”理念。,2026-01-31 07:48:03,https://finance.eastmoney.com/a/202601313637475994.html
美持续施压伊朗 特朗普：没有撤回军事部署的时间表,【美持续施压伊朗 特朗普：没有撤回军事部署的时间表】美国总统特朗普30日在回答媒体记者有关“是否向伊朗设定达成协议的最后期限”时回答称，已同伊方沟通，但没有透露具体日期，他称“只有伊朗自己知道”。,2026-01-31 07:35:52,https://finance.eastmoney.com/a/202601313637518876.html
利好来了！上海重大发布！事关消费 最高补贴不超2万元,【利好来了！上海重大发布！事关消费 最高补贴不超2万元】1月30日，上海市发改委、上海市财政局发布《关于上海市贯彻实施2026年大规模设备更新和消费品以旧换新政策的通知》，其中明确，支持工业、电子信息、能源电力、交通运输等线下消费商业设施设备更新项目申报。在消费品以旧换新方面，通知提出，给予汽车报废更新补贴支持，购买新能源乘用车补贴最高不超过2万元；给予汽车置换更新补贴支持，购买新能源乘用车补贴最高不超1.5万元。,2026-01-31 07:27:29,https://finance.eastmoney.com/a/202601313637477127.html
深夜“血洗”！白银史诗级暴跌！黄金创40年最大跌幅！,【深夜“血洗”！白银史诗级暴跌！黄金创40年最大跌幅！】北京时间1月31日凌晨，现货白银价格一度暴跌36%，创出历史最大日内跌幅；现货黄金价格一度下跌超过12%，盘中跌穿每盎司4700美元，遭遇40年来单日最大跌幅。,2026-01-31 07:26:45,https://finance.eastmoney.com/a/202601313637477033.html
打还是谈 美国伊朗“红线”对决 中东“火药桶”持续升温,【打还是谈 美国伊朗“红线”对决 中东“火药桶”持续升温】中东局势连日来持续紧张，美国不断调派军力。有消息称，美国在中东已经部署至少10艘军舰。近一周，美国还向中东调派了42架运输机。同时美方又释放对话信号，从军事、外交上持续对伊朗施压。伊朗方面则强硬回击，表示对侵略行为将果断回应。美国与伊朗当前各自的核心要求是什么？是否还能通过谈判解决问题？如果美国真对伊朗进行军事打击，伊朗会如何反击？,2026-01-31 07:11:26,https://finance.eastmoney.com/a/202601313637475478.html
碳酸锂价格震荡上行 锂矿企业业绩大幅回暖,【碳酸锂价格震荡上行 锂矿企业业绩大幅回暖】“目前，公司产销正常，碳酸锂产品供不应求，没什么库存。”1月30日，某碳酸锂企业相关负责人对中国证券报记者表示。自2025年下半年以来，碳酸锂价格持续回暖，价格从7万元/吨一度涨至17万元/吨左右。中国化学与物理电源行业协会动力电池应用分会研究中心总经理周波对中国证券报记者表示，近半年来，碳酸锂市场呈现“供应偏紧与需求高预期”并存的局面。受此影响，多家锂矿企业预计2025年全年业绩将显著回暖。,2026-01-31 07:04:15,https://finance.eastmoney.com/a/202601313637474376.html
华北中南部黄淮中西部等地有雾霾天气,【华北中南部黄淮中西部等地有雾霾天气】据中央气象台，1月31日至2月1日，华北中南部、黄淮中西部、汾渭平原、新疆天山北坡等地大气扩散条件一般，上述地区有轻至中度霾，局地重度霾。2月2日起，受弱冷空气影响，华北中部、黄淮中部的霾天气减弱或消散，但华北南部、黄淮西部等地霾天气继续维持，部分地区将有轻至中度霾，局地重度霾。5日起，受冷空气影响，上述地区霾天气自北向南逐渐减弱消散。此外，31日早晨至上午，河北南部、河南中部、山西中南部、山东西部、新疆天山北坡等地有大雾天气，局地有能见度低于200米的强浓雾。,2026-01-31 06:53:59,https://finance.eastmoney.com/a/202601313637472888.html
美国务院要求非紧急政府雇员从尼日尔撤离,【美国务院要求非紧急政府雇员从尼日尔撤离】当地时间1月30日，美国国务院表示，由于安全风险，已下令非紧急政府雇员及其家属撤离尼日尔。,2026-01-31 06:39:42,https://finance.eastmoney.com/a/202601313637468859.html
俄罗斯重新将14名日本人列为战犯,【俄罗斯重新将14名日本人列为战犯】俄罗斯外交部发言人扎哈罗娃当地时间1月30日表示，俄方持续揭露日本军国主义罪行，近期重新将14名日本人认定为战犯。,2026-01-31 06:39:11,https://finance.eastmoney.com/a/202601313637468741.html
宝可梦就“靖国神社活动计划”公开致歉,【宝可梦就“靖国神社活动计划”公开致歉】日本知名游戏动漫IP宝可梦运营的网站上近日出现消息称，计划于1月31日在供奉日本甲级战犯的靖国神社举办相关活动，引发轩然大波。宝可梦网站1月30日用中日双语发布公告致歉：今后将从根本上改变并强化活动信息的审查体系与确认流程，杜绝此类问题再次发生。,2026-01-31 06:34:17,https://finance.eastmoney.com/a/202601313637468530.html
美联储理事鲍曼表示 期待与美国总统特朗普的美联储主席提名人凯文·沃什合作,美联储理事鲍曼表示，期待与美国总统特朗普的美联储主席提名人凯文·沃什合作。,2026-01-31 06:28:40,https://finance.eastmoney.com/a/202601313637468220.html
急速大跳水！贵金属重挫 现货白银盘中一度跌超36%,【急速大跳水！贵金属重挫 现货白银盘中暴跌超30%】贵金属剧烈波动！继昨晚大幅震荡后，黄金、白银价格今日继续高台跳水。截至发稿，现货白银向下跌破76美元/盎司，日内下跌34.36%。现货黄金日内跌幅扩大至12%，报4705.29美元/盎司。,2026-01-31 06:26:56,https://finance.eastmoney.com/a/202601303637078841.html
美国众议院议长约翰逊告诉众院共和党成员们 他希望下周一能表决参议院（投票通过并）递交的政府融资立法草案,美国众议院议长约翰逊告诉众院共和党成员们，他希望下周一能表决参议院（投票通过并）递交的政府融资立法草案。,2026-01-31 06:13:51,https://finance.eastmoney.com/a/202601313637459163.html
周六你需要知道的隔夜全球要闻：特朗普相中鹰派老将沃什掌舵美联储 黄金、白银断崖式崩盘；美国公开爱泼斯坦案海量档案；SpaceX上市估值剑指1.5万亿美元,【周六你需要知道的隔夜全球要闻：特朗普相中鹰派老将沃什掌舵美联储 黄金、白银断崖式崩盘；美国公开爱泼斯坦案海量档案；SpaceX上市估值剑指1.5万亿美元】1、美国总统特朗普提名前美联储理事凯文·沃什担任下任美联储主席。这一提名还需获得参议院批准。2、因市场担忧沃什的鹰派立场，贵金属获利抛压激增，黄金、白银出现崩盘式跳水，白银盘中一度暴跌36%，黄金最高跌超12%。现货黄金最终收跌9.52%，报4865美元/盎司。白银收跌26.9%，报84.7美元/盎司。黄金、白银1月仍有12%、18%的涨幅。现货铂金重挫17.59%，1月累涨1.65%。现货钯金重挫14.89%，1月累涨4.66%。,2026-01-31 06:12:34,https://finance.eastmoney.com/a/202601313637459036.html
美联储理事鲍曼表示 劳动力市场面临的下行风险尚未消退,美联储理事鲍曼表示，劳动力市场面临的下行风险尚未消退。,2026-01-31 06:04:25,https://finance.eastmoney.com/a/202601313637458792.html
国际油价30日下跌,【国际油价30日下跌】国际油价30日下跌。截至当天收盘，纽约商品交易所3月交货的轻质原油期货价格下跌21美分，收于每桶65.21美元，跌幅为0.32%；3月交货的伦敦布伦特原油期货价格下跌2美分，收于每桶70.69美元，跌幅为0.03%。,2026-01-31 06:00:28,https://finance.eastmoney.com/a/202601313637458612.html
世卫组织通报印度尼帕病毒感染情况,【世卫组织通报印度尼帕病毒感染情况】世界卫生组织网站30日发布公报，通报近期印度尼帕病毒感染情况。公报说，印方26日向世卫组织报告西孟加拉邦两例经实验室确诊的尼帕病毒感染病例。尚未发现其他病例。,2026-01-31 05:48:20,https://finance.eastmoney.com/a/202601313637456677.html
特斯拉股价逆市走强 SpaceX上市在即曝马斯克整合大棋,【特斯拉股价逆市走强 SpaceX上市在即曝马斯克整合大棋】截至周五（1月30日）美股收盘，三大指数集体下跌，科技巨头多数走低，仅苹果和特斯拉收涨，其中特斯拉股价涨3.32%。前一日有消息称，埃隆·马斯克旗下的SpaceX正探讨与特斯拉进行潜在合并，同时还考虑与同属于马斯克的人工智能初创公司xAI深化战略合作。,2026-01-31 05:43:22,https://finance.eastmoney.com/a/202601313637456419.html
美元指数30日上涨,【美元指数30日上涨】衡量美元对六种主要货币的美元指数当天上涨0.73%，在汇市尾市收于96.989。截至纽约汇市尾市，1欧元兑换1.1865美元，低于前一交易日的1.1951美元；1英镑兑换1.3696美元，低于前一交易日的1.3802美元。1美元兑换154.56日元，高于前一交易日的152.99日元；1美元兑换0.7722瑞士法郎，高于前一交易日的0.7668瑞士法郎；1美元兑换1.3602加元，高于前一交易日的1.3513加元；1美元兑换8.8927瑞典克朗，高于前一交易日的8.8268瑞典克朗。,2026-01-31 05:42:48,https://finance.eastmoney.com/a/202601313637456339.html
穆迪确认以色列Baa1评级 前景展望从负面修订为稳定,穆迪确认以色列Baa1评级，前景展望从负面修订为稳定。,2026-01-31 05:42:10,https://finance.eastmoney.com/a/202601313637456224.html
SpaceX去年营收据悉约为150-160亿美元,【SpaceX去年营收据悉约为150-160亿美元】据报道，SpaceX去年营收约150-160亿美元，星链占SpaceX总收入的50%至80%。SpaceX计划在6月IPO中筹集500亿美元。SpaceX目标保守估值为1.5万亿美元。,2026-01-31 05:33:02,https://finance.eastmoney.com/a/202601313637456116.html
美国财政部下辖国税局（IRS）打算在特朗普政府停摆的第一周让所有工作人员到岗,美国财政部下辖国税局（IRS）打算在特朗普政府停摆的第一周让所有工作人员到岗。,2026-01-31 05:28:31,https://finance.eastmoney.com/a/202601313637455772.html
古特雷斯：联合国面临财政崩溃 资金可能在7月前耗尽,【古特雷斯：联合国面临财政崩溃 资金可能在7月前耗尽】当地时间1月30日，联合国秘书长古特雷斯警告称，由于未缴会费不断累积，联合国的资金可能在7月前耗尽，这个全球机构正面临“迫在眉睫的财政崩溃”。,2026-01-31 05:27:58,https://finance.eastmoney.com/a/202601313637455663.html
CBOE波动率指数上涨0.56点至17.44,CBOE波动率指数上涨0.56点至17.44，创下自1月20日以来的最高收盘点位。,2026-01-31 05:27:33,https://finance.eastmoney.com/a/202601313637455537.html
富时中国A50指数期货夜盘收跌0.30%,富时中国A50指数期货夜盘收跌0.30%，报14910点。,2026-01-31 05:15:50,https://finance.eastmoney.com/a/202601313637455446.html
美国总统特朗普据称将提名Brett Matsumoto担任劳工部下辖劳工统计局（BLS）的局长,美国总统特朗普据称将提名Brett Matsumoto担任劳工部下辖劳工统计局（BLS）的局长。,2026-01-31 05:15:47,https://finance.eastmoney.com/a/202601313637455398.html
标普确认意大利BBB+/A-2评级 前景展望由稳定上修至正面,标普确认意大利BBB+/A-2评级，前景展望由稳定上修至正面。,2026-01-31 05:08:45,https://finance.eastmoney.com/a/202601313637455184.html
纳斯达克中国金龙指数收跌2.36%,【纳斯达克中国金龙指数收跌2.36%】热门中概股多数下跌，纳斯达克中国金龙指数跌2.36%，1月累涨2.69%。哔哩哔哩、理想汽车、小鹏汽车跌超3%，阿里巴巴、网易、百度、京东跌超2%。,2026-01-31 05:08:00,https://finance.eastmoney.com/a/202601313637455077.html
美股三大指数收盘集体下跌,美股三大指数收盘集体下跌，道指跌0.36%，1月累涨1.73%；纳指跌0.94%，1月累涨0.95%；标普500指数跌0.43%，1月累涨1.37%。科技股普跌，AMD跌超6%，英特尔跌超4%。黄金、白银股大幅下挫，全球最大白银ETF--iShares Silver Trust跌28%，科尔黛伦矿业跌超16%，金田跌超14%。,2026-01-31 05:06:33,https://finance.eastmoney.com/a/202601313637454987.html
刚果（金）东部鲁巴亚钽矿坍塌事故致200多人死亡,刚果（金）东部鲁巴亚钽矿坍塌事故致200多人死亡。,2026-01-31 05:04:06,https://finance.eastmoney.com/a/202601313637454862.html
美国参议院多数党领袖图恩表示 参议院周五将表决修订版拨款协议,美国参议院多数党领袖图恩表示，参议院周五将表决修订版拨款协议。,2026-01-31 04:48:35,https://finance.eastmoney.com/a/202601313637454163.html
以色列官员向美方提供伊朗导弹计划情报,【以色列官员向美方提供伊朗导弹计划情报】本周稍早前，以色列国防军情报局局长什洛米·宾德尔在访问华盛顿期间，向美国提供了以色列掌握的情报信息，其中包括伊朗恢复弹道导弹计划的相关信息。据悉，以色列预计，美国总统特朗普在下令对伊朗发动袭击前，会先尝试各种谈判手段。,2026-01-31 04:45:44,https://finance.eastmoney.com/a/202601313637454071.html
格陵兰岛自治政府总理：尚未达成任何协议,【格陵兰岛自治政府总理：尚未达成任何协议】哥本哈根消息：格陵兰岛自治政府总理延斯-弗雷德里克·尼尔森在格陵兰广播公司30日播发的采访中说，尚未达成有关格陵兰岛的任何协议，局势仍充满挑战。,2026-01-31 04:39:46,https://finance.eastmoney.com/a/202601313637453737.html
伊朗最高领袖顾问：已掌握敌方作战计划 将适时发动打击,【伊朗最高领袖顾问：已掌握敌方作战计划 将适时发动打击】当地时间1月30日，伊朗最高领袖哈梅内伊的政治顾问阿里·沙姆哈尼称，现在绝对首要任务是做好充分准备，以遏制任何威胁。,2026-01-31 04:31:42,https://finance.eastmoney.com/a/202601313637453839.html
杰夫·贝索斯旗下蓝色起源公司将新谢泼德火箭项目暂停两年,杰夫·贝索斯旗下蓝色起源公司将新谢泼德火箭项目暂停两年。,2026-01-31 04:25:12,https://finance.eastmoney.com/a/202601313637453628.html
美联储理事米兰表示 特朗普从未要求他在货币政策方面做任何事情,美联储理事米兰表示，特朗普从未要求他在货币政策方面做任何事情。,2026-01-31 04:14:24,https://finance.eastmoney.com/a/202601313637453332.html
赴港与回A双向流动A+H阵营持续扩容,【赴港与回A双向流动A+H阵营持续扩容】1月30日，随着澜起科技启动招股，港股市场上出现澜起科技、国恩科技、大族数控、牧原股份4家A股龙头公司同场招股的盛况。在A股公司赴港上市之际，智谱、中国宏桥、越疆、光大环境等港股公司正以多元路径加速A股上市。随着上市公司双向流动更加频繁，两地资本市场呈现出加速融合的发展态势。,2026-01-31 04:06:41,https://finance.eastmoney.com/a/202601313637438134.html
参议院民主党党鞭Durbin就凯文·沃什发表声明 质疑沃什是否有“胆量”指出特朗普的政策错误,参议院民主党党鞭Durbin就凯文·沃什发表声明，质疑沃什是否有“胆量”指出特朗普的政策错误。,2026-01-31 03:46:59,https://finance.eastmoney.com/a/202601313637451052.html
阿根廷政府宣布部分省份因火灾进入紧急状态,【阿根廷政府宣布部分省份因火灾进入紧急状态】阿根廷政府30日发布紧急法令，宣布该国丘布特省、里奥内格罗省、内乌肯省和拉潘帕省因受森林火灾影响进入为期一年的紧急状态。该法令还授权国家安全部下属联邦紧急事务局负责协调灭火、援助民众及支持各省进行社会和生产恢复等。阿根廷国家安全部29日宣布拨款超过1000亿阿根廷比索（约合6900万美元），用于加强国家志愿消防员系统的运作能力。,2026-01-31 03:44:19,https://finance.eastmoney.com/a/202601313637450994.html
特朗普：已向伊朗告知达成协议的最后期限,【特朗普：已向伊朗告知达成协议的最后期限】美国总统特朗普30日称，伊朗希望同美国达成协议，他已向伊朗方面告知达成协议的最后期限。特朗普当天在白宫签署一项行政令时回答媒体提问。被问及是否有达成协议的最后期限时，特朗普称已同伊方沟通，但没有透露具体日期，说“只有他们自己知道”。,2026-01-31 03:43:20,https://finance.eastmoney.com/a/202601313637450894.html
美国天然气期货日内涨12.00%,美国天然气期货日内涨12.00%，现报4.389美元/百万英热。,2026-01-31 03:41:37,https://finance.eastmoney.com/a/202601313637450798.html
美联储穆萨莱姆表示 沃什完全可以胜任美联储主席一职,美联储穆萨莱姆表示，沃什完全可以胜任美联储主席一职。,2026-01-31 03:36:40,https://finance.eastmoney.com/a/202601313637450494.html
据报道 参议员沃伦周五致信沃什 询问沃什是否支持美国司法部对鲍威尔和库克的调查,据报道，参议员沃伦周五致信沃什，询问沃什是否支持美国司法部对鲍威尔和库克的调查。,2026-01-31 03:24:34,https://finance.eastmoney.com/a/202601313637450352.html
委内瑞拉外交部：美对古巴相关措施直接侵犯贸易自由,【委内瑞拉外交部：美对古巴相关措施直接侵犯贸易自由】当地时间1月30日，委内瑞拉外交部发表声明，强烈反对美国针对古巴发布的行政命令。声明称，该举措意在对同古巴保持正当经贸往来的国家实施惩罚性制裁。,2026-01-31 03:08:20,https://finance.eastmoney.com/a/202601313637449473.html
特朗普称希望与伊朗达成协议,特朗普称希望与伊朗达成协议。,2026-01-31 03:04:30,https://finance.eastmoney.com/a/202601313637449318.html
恒生指数主连夜盘收跌0.62%,恒生指数主连夜盘收跌0.62%，报27330点。恒生科技指数主连夜盘收跌0.94%，报5685点。,2026-01-31 03:00:57,https://finance.eastmoney.com/a/202601313637448720.html
据报道 苹果公司近期又有多名人工智能研究人员和Siri团队高管离职,据报道，苹果公司近期又有多名人工智能研究人员和Siri团队高管离职。,2026-01-31 02:58:57,https://finance.eastmoney.com/a/202601313637448550.html
墨西哥主要股票指数下跌逾2%,墨西哥主要股票指数下跌逾2%。,2026-01-31 02:57:21,https://finance.eastmoney.com/a/202601313637448435.html
贵金属市场抛压暂缓 黄金、白银均从底部反弹,【贵金属市场抛压暂缓 黄金、白银均从底部反弹】贵金属市场抛售暂告段落，黄金、白银均从底部反弹。截至目前，现货黄金跌9.78%，报4851.42美元/盎司；现货白银跌28.30%，报82.73美元/盎司。此前，现货白银最高跌超36%，现货黄金最高跌超12%。,2026-01-31 02:56:03,https://finance.eastmoney.com/a/202601313637448357.html
现货白银向下跌破74美元/盎司,【现货白银向下跌破74美元/盎司】现货白银向下跌破74美元/盎司，日内下跌36.22%。,2026-01-31 02:42:00,https://finance.eastmoney.com/a/202601313637448021.html
民主党参议员沃伦：沃什并非他们需要的美联储主席人选,民主党参议员沃伦表示，沃什并非他们需要的美联储主席人选。,2026-01-31 02:36:16,https://finance.eastmoney.com/a/202601313637448133.html
特朗普：美正计划重建“传统意义上的战列舰”,【特朗普：美正计划重建“传统意义上的战列舰”】当地时间1月30日，美国总统特朗普表示，伊朗当前局势“相当严峻”。他已明确警告伊朗，对方随后选择退让，这显示相关方面“确实希望达成协议”。,2026-01-31 02:32:50,https://finance.eastmoney.com/a/202601313637448251.html
美联储官员穆萨莱姆：此时降低利率是不明智的,【美联储官员穆萨莱姆：此时降低利率是不明智的】美联储官员穆萨莱姆表示，此时降低利率是不明智的。就业市场显著恶化的风险降低，如果出现就业市场走弱的新证据，可能会支持降息。短期内通胀不太可能加速，如果通胀预期降至目标水平，可能会支持降息。预计美国2026年经济增长将达到或超过趋势水平。,2026-01-31 02:31:59,https://finance.eastmoney.com/a/202601313637448674.html
瑞典克朗兑美元下跌1% 至盘中低点8.8941,瑞典克朗兑美元下跌1%，至盘中低点8.8941。,2026-01-31 02:25:57,https://finance.eastmoney.com/a/202601313637447095.html
美联储隔夜逆回购协议周五使用规模为96.29亿美元 上个交易日报28.52亿美元,美联储隔夜逆回购协议（RRP）周五使用规模为96.29亿美元（交易对手8家），上个交易日报28.52亿美元。,2026-01-31 02:24:08,https://finance.eastmoney.com/a/202601313637446980.html
标普500指数跌幅扩大至1%,标普500指数跌幅扩大至1%。,2026-01-31 02:23:25,https://finance.eastmoney.com/a/202601313637446861.html
现货黄金日内跌幅扩大至12% 报4705.29美元/盎司,现货黄金日内跌幅扩大至12%，报4705.29美元/盎司。,2026-01-31 02:22:38,https://finance.eastmoney.com/a/202601313637446788.html
现货白银向下跌破76美元/盎司 日内下跌34.36%,现货白银向下跌破76美元/盎司，日内下跌34.36%。,2026-01-31 02:21:58,https://finance.eastmoney.com/a/202601313637446687.html
美联合健康集团高管枪杀案嫌疑人将不会面临死刑,【美联合健康集团高管枪杀案嫌疑人将不会面临死刑】当地时间1月30日，美国纽约一名联邦法官驳回了针对被控枪杀联合健康集团高管布莱恩·汤普森的嫌疑人路易吉·曼吉奥内可适用死刑的相关指控，其中包括谋杀指控和武器相关指控，这意味着死刑不再作为该案的量刑选项。,2026-01-31 02:21:02,https://finance.eastmoney.com/a/202601313637446419.html
现货白银向下跌破78美元/盎司 日内下跌32.44%,现货白银向下跌破78美元/盎司，日内下跌32.44%。,2026-01-31 02:20:09,https://finance.eastmoney.com/a/202601313637446325.html
现货白银日内跌幅扩大至30%,【现货白银日内跌幅扩大至30%】恐慌性抛售席卷贵金属市场，现货白银日内跌幅扩大至30%，报80.67美元/盎司。现货黄金日内跌幅扩大至11%，报4788美元/盎司。,2026-01-31 02:17:45,https://finance.eastmoney.com/a/202601313637444544.html
